[
  {
    "id": "floor_system",
    "depth": "floor",
    "agent": "_system",
    "kind": "hub",
    "label": "Raptor Academy",
    "disclosure": {
      "sentence": "Raptor is an agentic AI and XR training academy for enterprise and media education, where the mechanical work of teaching a technical class is carried out by agents that an instructor directs in ordinary language.",
      "paragraph": "The building is the academy seen from above. Each floor is a working area, each office belongs to one agent, and each desk is a capability that agent can be asked to perform. Opening any of them shows what that part actually does, what it runs on, and whether it is running today or drawn here as part of the layout.",
      "deep": {
        "specs": [
          "The entire system runs locally on one 48 GB workstation GPU. Language inference is served by llama.cpp on a single machine, image and mesh generation share the same card, and no part of the teaching path depends on a hosted model.",
          "Work that has been performed correctly once is captured as a recipe with a scorer attached, and is re-run afterward by a smaller local model rather than re-authored. One hundred and thirteen recipes are registered."
        ]
      }
    },
    "children": [
      "office_aribot",
      "office_anabot",
      "office_edbot",
      "office_artbot",
      "timeline_step_01",
      "timeline_step_02",
      "timeline_step_03",
      "timeline_step_04",
      "timeline_step_05",
      "timeline_step_06"
    ],
    "assets": {}
  },
  {
    "id": "office_aribot",
    "depth": "office",
    "agent": "aribot",
    "kind": "agent",
    "label": "AriBot",
    "disclosure": {
      "sentence": "AriBot is the orchestrator, and it is the agent an instructor talks to when they do not know which agent they need.",
      "paragraph": "AriBot receives requests in a Discord channel, decides which agent and which recipe answers them, and dispatches the work. It holds the state that the other agents read and write, so that a scene change made by one agent is visible to the rest, and it reports back into the same channel the request arrived in.",
      "deep": {
        "specs": [
          "Qwen3.6-35B-A3B served by llama.cpp on port 8090, sharing a single 49,140 MiB workstation card with the image and mesh generators, and bound to the full recipe index and to the Discord and world-state tool sets."
        ]
      }
    },
    "children": [
      "desk_aribot_orchestrate",
      "desk_aribot_discord",
      "desk_aribot_world_state",
      "brain_aribot_model",
      "brain_aribot_tools",
      "brain_aribot_memory",
      "brain_aribot_loop"
    ],
    "assets": {
      "still": {
        "key": "al_aribot_M-C_still_00001.png",
        "sha256": "b770a05708921b6e8bb1365b84f76367b94a060ce5709fe10b302e727374cb57"
      },
      "idle": {
        "key": "al_aribot_M-C_idle_00001.webp",
        "sha256": "3f9a5622bba65c661c06b00fd01294bafdb468c39e2a586cb076dac60a77d707"
      },
      "disassemble": {
        "key": "al_aribot_C-C_disassemble_00001.webp",
        "sha256": "9a67fc3ffdae11213a87b4de1cd7787d0d6f5c3df72f4d9d64eda9f457cfda28"
      }
    }
  },
  {
    "id": "office_anabot",
    "depth": "office",
    "agent": "anabot",
    "kind": "agent",
    "label": "AnaBot",
    "disclosure": {
      "sentence": "TABot is the teaching assistant, and its first working capability is turning what someone says out loud into a structured plan the class can act on.",
      "paragraph": "When a session is recorded, TABot transcribes it locally, organises the unstructured speech into ranked priorities with a weekly working structure, and posts the result into the class channel with every point quoting the exact words it came from. That cited record is the substrate the rest of the assistant is built on: what is due and who is waiting, platform answers drawn from a card store the instructor writes and corrects, and escalation to the instructor with the context attached.",
      "deep": {
        "specs": [
          "Shares the local inference substrate with the other agents and is distinguished by its recipe family and tool binding rather than by a separate model. Transcription runs on a local Whisper large-v3 service on the same machine, and the organising step runs on the same local language model as the rest of the academy."
        ]
      }
    },
    "children": [
      "desk_anabot_assignments",
      "desk_anabot_questions",
      "desk_anabot_grading",
      "brain_anabot_model",
      "brain_anabot_tools",
      "brain_anabot_memory",
      "brain_anabot_loop"
    ],
    "assets": {
      "still": {
        "key": "al_anabot_M-C_still_00001.png",
        "sha256": "770713b4ff4dc5606402c6f94d99ca53e28f49e57c18d99b85acedb4f7632e68"
      },
      "idle": {
        "key": "al_anabot_M-C_idle_00001.webp",
        "sha256": "ae3aa436b615de5bb56f452ad4622fda65f58b9df90e33577a4c9e184c48afc7"
      },
      "disassemble": {
        "key": "al_anabot_C-C_disassemble_00001.webp",
        "sha256": "f8bfb959c13e869973ac1e36b837a9115f0af9c78a550f889fe2c406c1042730"
      }
    }
  },
  {
    "id": "office_edbot",
    "depth": "office",
    "agent": "edbot",
    "kind": "agent",
    "label": "EdBot",
    "disclosure": {
      "sentence": "StreamBot produces the class, and it is the agent that keeps a teaching stream running while the instructor teaches.",
      "paragraph": "StreamBot drives OBS directly: it switches scenes, starts and stops recording, and confirms each change by reading the state back rather than assuming the command landed. It holds a cue sheet of the session's segments and can move forward, jump to a named point, or repeat one, which means a class that goes wrong in the middle does not have to start again from the beginning.",
      "deep": {
        "specs": [
          "Connects to OBS over its WebSocket interface on port 4455. Scene switches are verified by read-back and fail loudly on mismatch. The session cue sheet records which segments can be re-entered and which cannot."
        ]
      }
    },
    "children": [
      "desk_edbot_obs",
      "desk_edbot_routing",
      "desk_edbot_xr",
      "brain_edbot_model",
      "brain_edbot_tools",
      "brain_edbot_memory",
      "brain_edbot_loop"
    ],
    "assets": {
      "still": {
        "key": "al_edbot_M-C_still_00001.png",
        "sha256": "17b6cba60fbea73c133f5adb964461abb635ed48d41ea58ccee220f357ee2c17"
      },
      "idle": {
        "key": "al_edbot_C-C_idle_00001.webp",
        "sha256": "117148c91d8bce5ab5d318db8a2c85a76d7b79bfb571498f10eee1a276120af6"
      },
      "disassemble": {
        "key": "al_edbot_C-C_disassemble_00001.webp",
        "sha256": "1dcee6ad0c3b29d4aa9f90b61d2edacb1203a8470ef2599bdfed821dbf9f0714"
      }
    }
  },
  {
    "id": "office_artbot",
    "depth": "office",
    "agent": "artbot",
    "kind": "agent",
    "label": "ArtBot",
    "disclosure": {
      "sentence": "XRBot builds the module, and it is the agent that turns a description into something a student can walk into.",
      "paragraph": "XRBot generates images and meshes from recorded workflows, assembles them with the scene code into a WebXR module, and publishes it. Because the generation step records the exact workflow that produced each asset, an asset that is lost or needs a variation is reproduced from that record rather than re-prompted from scratch.",
      "deep": {
        "specs": [
          "Dispatches to a local ComfyUI instance sharing the same GPU, and to TRELLIS for mesh generation. Every generated asset is written to an index carrying the hash of the workflow that produced it; the index currently holds three hundred and twenty-one entries."
        ]
      }
    },
    "children": [
      "desk_artbot_asset_gen",
      "desk_artbot_module_build",
      "desk_artbot_deploy",
      "brain_artbot_model",
      "brain_artbot_tools",
      "brain_artbot_memory",
      "brain_artbot_loop"
    ],
    "assets": {
      "still": {
        "key": "al_artbot_M-C_still_00001.png",
        "sha256": "b5174b35e810fe5cbbcf1504d95a4ce6525c46ade7e160554a284a8da9f45f50"
      },
      "idle": {
        "key": "al_artbot_M-C_idle_00001.webp",
        "sha256": "2d669ae37a4df78173a76855581f5fe589718668095692d673000b40aa9d32af"
      },
      "disassemble": {
        "key": "al_artbot_C-C_disassemble_00001.webp",
        "sha256": "aa48a1403a295466a7fc17ebd09bf7bdac7360b5f3a8370de1776587e37278b3"
      }
    }
  },
  {
    "id": "desk_aribot_orchestrate",
    "depth": "desk",
    "agent": "aribot",
    "kind": "capability",
    "label": "Orchestration",
    "disclosure": {
      "sentence": "Orchestration decides which agent and which recipe answers a request, and dispatches it.",
      "paragraph": "A request arrives as ordinary language and is matched against the registered recipe index. When a recipe covers it, the recipe runs and its scorer grades the result. When nothing covers it, the request is refused with the reason stated rather than answered approximately, which is what keeps the boundary between what the system can do and what it cannot from blurring in use."
    },
    "children": [],
    "assets": {}
  },
  {
    "id": "desk_aribot_discord",
    "depth": "desk",
    "agent": "aribot",
    "kind": "capability",
    "label": "Discord",
    "disclosure": {
      "sentence": "Discord is where the academy is operated from, and every request and result passes through it.",
      "paragraph": "Each module has its own channel, and a channel is bound to the recipe family that serves it, so asking in the right room is how the system knows what kind of work is being requested. Commands and mentions are authorised per user and per channel, and results are posted back into the channel the request came from so the whole exchange stays in one readable place."
    },
    "children": [],
    "assets": {}
  },
  {
    "id": "desk_aribot_world_state",
    "depth": "desk",